{
  "sweep_version": 1,
  "sweep_id": "probe_standoff_pairs",
  "members": [
    {
      "member_id": "street_layout_probe.base",
      "assignments": [],
      "outcome": "compiled",
      "specification": "street_layout_probe.base/street_layout_probe.base.scenario.json",
      "findings": [
        {
          "check": 17,
          "outcome": "warn",
          "subject": "vehicle class saloon",
          "message": "draws one body, vehicle.lincoln.mkz, so every vehicle of the class looks the same and its appearance can become its label"
        },
        {
          "check": 41,
          "outcome": "warn",
          "subject": "supervision",
          "message": "I(band; supervision) / H(supervision) = 0.000 over 2 entries (captured by the declared windows). Expected in a pattern of life and never a refusal; the table, the bands where both states occur and the ways of changing the numbers are in the resolution report, and the statistic is in the lock"
        }
      ],
      "epoch_block_sha256": "9335fe33ca8330c53de6c5901cabbfaf8583ddd0b52fa5f2c5e076785c615c1b",
      "illumination": {
        "illumination_version": 1,
        "policy": "advance",
        "rate_sun_s_per_sim_s": 1.0,
        "note": "the sun follows simulated time"
      },
      "files": {
        "routes": "30d9547e8fe234ac46ff851ef12e1874d371ea26e47efdd1f3b4216e7e9f6c43",
        "config": "d87ed6f660e70b61d71df38532188aa6ccaef78f01f44a6abb68e814fa5a998c",
        "network": "09aa2a8cad92df5f08c0bb8259b23cb6d3303ec3e88ccf62f87e6133d460f9ae",
        "supervision": "891fda6764114bcfcb067fc52b984925461b03fead5444c72a12901df9f906e4"
      },
      "windows": [
        {
          "id": "morning",
          "civil_begin": "2026-03-21T07:00:00-06:00",
          "civil_date": "2026-03-21",
          "sun_open": {
            "seconds": 3600.0,
            "sun_date": "2026-03-21",
            "sun_clock": "07:00:00",
            "elevation_deg": -0.8498,
            "geometric_elevation_deg": -1.1398,
            "azimuth_deg": 88.7108
          }
        }
      ]
    },
    {
      "member_id": "street_layout_probe.base.cf.probe.nominal",
      "assignments": [],
      "outcome": "compiled",
      "specification": "street_layout_probe.base.cf.probe.nominal/street_layout_probe.base.cf.probe.nominal.scenario.json",
      "findings": [
        {
          "check": 17,
          "outcome": "warn",
          "subject": "vehicle class saloon",
          "message": "draws one body, vehicle.lincoln.mkz, so every vehicle of the class looks the same and its appearance can become its label"
        },
        {
          "check": 41,
          "outcome": "warn",
          "subject": "supervision",
          "message": "I(band; supervision) / H(supervision) = 0.000 over 2 entries (captured by the declared windows). Expected in a pattern of life and never a refusal; the table, the bands where both states occur and the ways of changing the numbers are in the resolution report, and the statistic is in the lock"
        }
      ],
      "epoch_block_sha256": "9335fe33ca8330c53de6c5901cabbfaf8583ddd0b52fa5f2c5e076785c615c1b",
      "illumination": {
        "illumination_version": 1,
        "policy": "advance",
        "rate_sun_s_per_sim_s": 1.0,
        "note": "the sun follows simulated time"
      },
      "files": {
        "routes": "2ee89e451c0497a89073d81f879c1a0cea40ba5f3383dbc135d20d427a0208d5",
        "config": "bf99e9203dfa0283f1897a52f81202f8279a0addadb3a100aab906e0721e7a02",
        "network": "09aa2a8cad92df5f08c0bb8259b23cb6d3303ec3e88ccf62f87e6133d460f9ae",
        "supervision": "1b67c88d848b794fca82e2f5a4e757bd271236d7b08a542f3fc702038790c072"
      },
      "windows": [
        {
          "id": "morning",
          "civil_begin": "2026-03-21T07:00:00-06:00",
          "civil_date": "2026-03-21",
          "sun_open": {
            "seconds": 3600.0,
            "sun_date": "2026-03-21",
            "sun_clock": "07:00:00",
            "elevation_deg": -0.8498,
            "geometric_elevation_deg": -1.1398,
            "azimuth_deg": 88.7108
          }
        }
      ],
      "counterfactual": {
        "counterfactual_pair_id": "street_layout_probe.base.cf.probe.nominal",
        "base_member": "street_layout_probe.base",
        "counterfactual_member": "street_layout_probe.base.cf.probe.nominal",
        "actor": "probe",
        "mode": "nominal",
        "displaced_in": [],
        "illumination_differs": false,
        "trajectories_expected_to_match": false,
        "statement": "identical inputs except one vehicle; a car-following model reacts to what is in front of it, so downstream trajectories are not expected to match"
      }
    },
    {
      "member_id": "street_layout_probe.base.cf.probe.absent",
      "assignments": [],
      "outcome": "compiled",
      "specification": "street_layout_probe.base.cf.probe.absent/street_layout_probe.base.cf.probe.absent.scenario.json",
      "findings": [
        {
          "check": 17,
          "outcome": "warn",
          "subject": "vehicle class saloon",
          "message": "draws one body, vehicle.lincoln.mkz, so every vehicle of the class looks the same and its appearance can become its label"
        },
        {
          "check": 41,
          "outcome": "warn",
          "subject": "supervision",
          "message": "I(band; supervision) / H(supervision) = undefined (one supervision state only) over 1 entry (captured by the declared windows). Expected in a pattern of life and never a refusal; the table, the bands where both states occur and the ways of changing the numbers are in the resolution report, and the statistic is in the lock"
        }
      ],
      "epoch_block_sha256": "9335fe33ca8330c53de6c5901cabbfaf8583ddd0b52fa5f2c5e076785c615c1b",
      "illumination": {
        "illumination_version": 1,
        "policy": "advance",
        "rate_sun_s_per_sim_s": 1.0,
        "note": "the sun follows simulated time"
      },
      "files": {
        "routes": "f6ad746bb0c9beb042dff3ce854c7e60da8681ede168d5713d777abd074d86c7",
        "config": "34a205babe0f14509fba15488576c1cce29cd61fb04e75ef252dde966dbfacee",
        "network": "09aa2a8cad92df5f08c0bb8259b23cb6d3303ec3e88ccf62f87e6133d460f9ae",
        "supervision": "731bd711da330b6213997cfb3c57b86242e213cc71a3c0e14799631590ffd5a3"
      },
      "windows": [
        {
          "id": "morning",
          "civil_begin": "2026-03-21T07:00:00-06:00",
          "civil_date": "2026-03-21",
          "sun_open": {
            "seconds": 3600.0,
            "sun_date": "2026-03-21",
            "sun_clock": "07:00:00",
            "elevation_deg": -0.8498,
            "geometric_elevation_deg": -1.1398,
            "azimuth_deg": 88.7108
          }
        }
      ],
      "counterfactual": {
        "counterfactual_pair_id": "street_layout_probe.base.cf.probe.absent",
        "base_member": "street_layout_probe.base",
        "counterfactual_member": "street_layout_probe.base.cf.probe.absent",
        "actor": "probe",
        "mode": "absent",
        "displaced_in": [],
        "illumination_differs": false,
        "trajectories_expected_to_match": false,
        "statement": "identical inputs except one vehicle; a car-following model reacts to what is in front of it, so downstream trajectories are not expected to match"
      }
    },
    {
      "member_id": "street_layout_probe.base.cf.probe.displaced",
      "assignments": [],
      "outcome": "compiled",
      "specification": "street_layout_probe.base.cf.probe.displaced/street_layout_probe.base.cf.probe.displaced.scenario.json",
      "findings": [
        {
          "check": 17,
          "outcome": "warn",
          "subject": "vehicle class saloon",
          "message": "draws one body, vehicle.lincoln.mkz, so every vehicle of the class looks the same and its appearance can become its label"
        },
        {
          "check": 41,
          "outcome": "warn",
          "subject": "supervision",
          "message": "I(band; supervision) / H(supervision) = undefined (one supervision state only) over 1 entry (captured by the declared windows). Expected in a pattern of life and never a refusal; the table, the bands where both states occur and the ways of changing the numbers are in the resolution report, and the statistic is in the lock"
        }
      ],
      "epoch_block_sha256": "9335fe33ca8330c53de6c5901cabbfaf8583ddd0b52fa5f2c5e076785c615c1b",
      "illumination": {
        "illumination_version": 1,
        "policy": "advance",
        "rate_sun_s_per_sim_s": 1.0,
        "note": "the sun follows simulated time"
      },
      "files": {
        "routes": "eab77b30210852bc7ef4eba75021fc9d5ae0f787e6b17d94290ceeea6cb48be0",
        "config": "8cc212344e3f1a9c66937c1acd6bccf537185250a35f4a340774917531cd1090",
        "network": "09aa2a8cad92df5f08c0bb8259b23cb6d3303ec3e88ccf62f87e6133d460f9ae",
        "supervision": "f384102e0c5251eb271feeade7abdffc0982c179e01694b2503f19804b4e2ccb"
      },
      "windows": [
        {
          "id": "morning",
          "civil_begin": "2026-03-21T07:00:00-06:00",
          "civil_date": "2026-03-21",
          "sun_open": {
            "seconds": 3600.0,
            "sun_date": "2026-03-21",
            "sun_clock": "07:00:00",
            "elevation_deg": -0.8498,
            "geometric_elevation_deg": -1.1398,
            "azimuth_deg": 88.7108
          }
        }
      ],
      "counterfactual": {
        "counterfactual_pair_id": "street_layout_probe.base.cf.probe.displaced",
        "base_member": "street_layout_probe.base",
        "counterfactual_member": "street_layout_probe.base.cf.probe.displaced",
        "actor": "probe",
        "mode": "displaced",
        "displaced_in": [
          "time"
        ],
        "illumination_differs": true,
        "trajectories_expected_to_match": false,